{
  "$schema": "engenty/ai-agent-manifest/v1",
  "id": "engenty.coder",
  "name": "Coder",
  "description": "Builds engenty Apps: single-page reactive frontends with an optional backend, their own working store, and a declared engenty capability surface. Writes real code — no DSL, no form builder.",
  "module_id": "engenty-apps",
  "skills": ["app-authoring", "engenty-bridge"],
  "tools": [
    "engenty_tools_search",
    "engenty_tool_execute",
    "artifact_create",
    "artifact_update",
    "memory_save"
  ]
}
